{"$schema":"https://json-schema.org/draft/2020-12/schema","$id":"urn:civicloop:schema:agents:agent-run:v1.0","title":"Agent run v1","type":"object","additionalProperties":false,"required":["schema_version","run_id","workflow_id","fixture_manifest_id","fixture_manifest_revision","fixture_manifest_digest","model_profile_id","model_profile_revision","privacy_mode","status","attempt","queued_at","started_at","finished_at","failure_category","telemetry"],"properties":{"schema_version":{"const":"1.0"},"run_id":{"type":"string","format":"uuid","maxLength":36},"workflow_id":{"type":"string","format":"uuid","maxLength":36},"fixture_manifest_id":{"type":["string","null"],"pattern":"^[a-z][a-z0-9_-]{2,63}$"},"fixture_manifest_revision":{"type":["integer","null"],"minimum":1,"maximum":1000000},"fixture_manifest_digest":{"type":["string","null"],"pattern":"^[a-f0-9]{64}$"},"model_profile_id":{"type":"string","pattern":"^[a-z][a-z0-9_-]{2,63}$"},"model_profile_revision":{"type":"integer","minimum":1,"maximum":1000000},"privacy_mode":{"enum":["synthetic_full","pilot_minimized","disabled"]},"status":{"enum":["queued","running","succeeded","failed","cancelled"]},"attempt":{"type":"integer","minimum":1,"maximum":10},"queued_at":{"type":"string","format":"date-time","maxLength":40},"started_at":{"type":["string","null"],"format":"date-time","maxLength":40},"finished_at":{"type":["string","null"],"format":"date-time","maxLength":40},"failure_category":{"type":["string","null"],"enum":[null,"budget_exhausted","cancelled","dependency_unavailable","invalid_output","provider_unavailable","timeout"]},"telemetry":{"type":"object","additionalProperties":false,"required":["trace_id","span_count"],"properties":{"trace_id":{"type":"string","pattern":"^[a-f0-9]{32}$"},"span_count":{"type":"integer","minimum":0,"maximum":1000},"revision_id":{"type":["string","null"],"maxLength":64},"package_id":{"type":["string","null"],"maxLength":64},"capability_profile":{"type":["string","null"],"maxLength":64},"provider":{"type":["string","null"],"enum":[null,"hermes","groq","openai"]},"model":{"type":["string","null"],"maxLength":120},"input_tokens":{"type":"integer","minimum":0,"maximum":10000000},"output_tokens":{"type":"integer","minimum":0,"maximum":10000000},"cost_microusd":{"type":"integer","minimum":0,"maximum":1000000000000},"fallback_category":{"type":["string","null"],"enum":[null,"none","provider_unavailable","budget","timeout"]},"approval_state":{"type":["string","null"],"enum":[null,"not_required","pending","approved","rejected"]},"connector_category":{"type":["string","null"],"enum":[null,"sandbox","read_only","none"]},"evaluation_labels":{"type":"array","maxItems":20,"uniqueItems":true,"items":{"type":"string","pattern":"^[a-z][a-z0-9_-]{1,63}$","maxLength":64}}}}},"allOf":[{"if":{"properties":{"status":{"const":"queued"}}},"then":{"properties":{"started_at":{"const":null},"finished_at":{"const":null},"failure_category":{"const":null}}}},{"if":{"properties":{"status":{"const":"running"}}},"then":{"properties":{"started_at":{"type":"string","format":"date-time"},"finished_at":{"const":null},"failure_category":{"const":null}}}},{"if":{"properties":{"status":{"const":"succeeded"}}},"then":{"properties":{"started_at":{"type":"string","format":"date-time"},"finished_at":{"type":"string","format":"date-time"},"failure_category":{"const":null}}}},{"if":{"properties":{"status":{"const":"failed"}}},"then":{"properties":{"started_at":{"type":"string","format":"date-time"},"finished_at":{"type":"string","format":"date-time"},"failure_category":{"enum":["budget_exhausted","dependency_unavailable","invalid_output","provider_unavailable","timeout"]}}}},{"if":{"properties":{"status":{"const":"cancelled"}}},"then":{"properties":{"finished_at":{"type":"string","format":"date-time"},"failure_category":{"const":"cancelled"}}}},{"if":{"properties":{"privacy_mode":{"const":"synthetic_full"}}},"then":{"properties":{"fixture_manifest_id":{"type":"string"},"fixture_manifest_revision":{"type":"integer"},"fixture_manifest_digest":{"type":"string"}}}},{"if":{"properties":{"privacy_mode":{"const":"pilot_minimized"}}},"then":{"properties":{"fixture_manifest_id":{"type":"null"},"fixture_manifest_revision":{"type":"null"},"fixture_manifest_digest":{"type":"null"}}}}]}
